{"schema_version":"1.0","generated_for_region":"geo1:4b213a0b9c466697fbd3","market":"Raleigh / Wake County + Census-adjacent counties","counties":[{"geoid":"37183","name":"Wake","role":"home"},{"geoid":"37037","name":"Chatham","role":"adjacent"},{"geoid":"37063","name":"Durham","role":"adjacent"},{"geoid":"37069","name":"Franklin","role":"adjacent"},{"geoid":"37077","name":"Granville","role":"adjacent"},{"geoid":"37085","name":"Harnett","role":"adjacent"},{"geoid":"37101","name":"Johnston","role":"adjacent"},{"geoid":"37127","name":"Nash","role":"adjacent"}],"sources":[{"source_id":"raleigh_city_events","name":"City of Raleigh Events","authority_tier":1,"publisher_type":"government","url":"https://raleighnc.gov/events","adapter_family":"custom_html","ingestion_methods":["html"],"readiness":"ready","access":"public","enabled_for_phase_0_5":true,"county_geoids":["37183"],"localities":["Raleigh"],"coverage_tags":["civic","parks","arts","community"],"structure_score":3,"coverage_score":4,"maintenance_score":3,"cost_score":5,"notes":"Authoritative Raleigh calendar with structured list/calendar views and event categories."},{"source_id":"visit_raleigh_events","name":"Visit Raleigh Events","authority_tier":2,"publisher_type":"tourism","url":"https://www.visitraleigh.com/events/","adapter_family":"simpleview","ingestion_methods":["rss","html"],"readiness":"ready","access":"public","enabled_for_phase_0_5":true,"county_geoids":["37183"],"localities":["Raleigh","Apex","Cary","Fuquay-Varina","Garner","Holly Springs","Knightdale","Morrisville","Rolesville","Wake Forest","Wendell","Zebulon"],"coverage_tags":["festivals","music","sports","food","arts","visitor_events"],"structure_score":4,"coverage_score":5,"maintenance_score":4,"cost_score":5,"notes":"Broad Wake County tourism calendar; site advertises event RSS and city/town filters."},{"source_id":"cary_town_calendar","name":"Town of Cary Calendar","authority_tier":1,"publisher_type":"government","url":"https://www.carync.gov/connect-engage/calendar","adapter_family":"vision_calendar","ingestion_methods":["html"],"readiness":"ready","access":"public","enabled_for_phase_0_5":false,"county_geoids":["37183"],"localities":["Cary"],"coverage_tags":["arts","concerts","food","festivals","sports","family","civic"],"structure_score":3,"coverage_score":4,"maintenance_score":3,"cost_score":5,"notes":"Rich municipal calendar with many event-type filters."},{"source_id":"ncsu_calendar","name":"NC State University Calendar","authority_tier":1,"publisher_type":"university","url":"https://calendar.ncsu.edu/","adapter_family":"localist","ingestion_methods":["feed","html"],"readiness":"ready","access":"public","enabled_for_phase_0_5":true,"county_geoids":["37183"],"localities":["Raleigh"],"coverage_tags":["university","community","arts","lectures","sports","workshops"],"structure_score":5,"coverage_score":4,"maintenance_score":5,"cost_score":5,"notes":"Localist-powered calendar with filters/subscriptions; many public community events."},{"source_id":"durham_city_calendar","name":"City of Durham Calendar","authority_tier":1,"publisher_type":"government","url":"https://www.durhamnc.gov/Calendar.aspx","adapter_family":"civicengage","ingestion_methods":["ical","html"],"readiness":"ready","access":"public","enabled_for_phase_0_5":true,"county_geoids":["37063"],"localities":["Durham"],"coverage_tags":["civic","parks","recreation"],"structure_score":5,"coverage_score":3,"maintenance_score":5,"cost_score":5,"notes":"CivicEngage calendar explicitly supports iCalendar subscription."},{"source_id":"discover_durham_events","name":"Discover Durham Events","authority_tier":2,"publisher_type":"tourism","url":"https://www.discoverdurham.com/events/","adapter_family":"simpleview","ingestion_methods":["html"],"readiness":"candidate","access":"public","enabled_for_phase_0_5":false,"county_geoids":["37063"],"localities":["Durham"],"coverage_tags":["festivals","music","food","markets","sports","community"],"structure_score":3,"coverage_score":5,"maintenance_score":3,"cost_score":5,"notes":"Very broad visitor-friendly Durham calendar; listing is JS-backed and needs endpoint/feed resolution."},{"source_id":"duke_calendar","name":"Duke University Event Calendar","authority_tier":1,"publisher_type":"university","url":"https://calendar.duke.edu/s/","adapter_family":"duke_feed","ingestion_methods":["feed","html"],"readiness":"ready","access":"public","enabled_for_phase_0_5":false,"county_geoids":["37063"],"localities":["Durham"],"coverage_tags":["university","arts","lectures","community","performances"],"structure_score":5,"coverage_score":4,"maintenance_score":5,"cost_score":5,"notes":"Official Duke calendar exposes a URL Feed Builder and activity feed."},{"source_id":"chatham_county_calendar","name":"Chatham County Calendar","authority_tier":1,"publisher_type":"government","url":"https://www.chathamcountync.gov/government/county-calendar","adapter_family":"vision_calendar","ingestion_methods":["html"],"readiness":"ready","access":"public","enabled_for_phase_0_5":true,"county_geoids":["37037"],"localities":[],"coverage_tags":["libraries","parks","recreation","civic","community"],"structure_score":3,"coverage_score":4,"maintenance_score":3,"cost_score":5,"notes":"County calendar includes libraries, parks/recreation, meetings and community programs."},{"source_id":"franklin_county_calendar","name":"Franklin County Calendar","authority_tier":1,"publisher_type":"government","url":"https://www.franklincountync.gov/calendar.aspx","adapter_family":"civicengage","ingestion_methods":["ical","html"],"readiness":"ready","access":"public","enabled_for_phase_0_5":true,"county_geoids":["37069"],"localities":[],"coverage_tags":["libraries","farmers_market","extension","parks","civic","community"],"structure_score":5,"coverage_score":5,"maintenance_score":5,"cost_score":5,"notes":"High-value CivicEngage calendar with many department calendars and iCalendar support."},{"source_id":"granville_county_calendar","name":"Granville County Calendar","authority_tier":1,"publisher_type":"government","url":"https://www.granvillecounty.org/Calendar.aspx","adapter_family":"civicengage","ingestion_methods":["ical","html"],"readiness":"ready","access":"public","enabled_for_phase_0_5":true,"county_geoids":["37077"],"localities":[],"coverage_tags":["libraries","markets","senior_services","civic","community"],"structure_score":5,"coverage_score":5,"maintenance_score":5,"cost_score":5,"notes":"CivicEngage calendar with County Events, Library and other calendars plus iCalendar."},{"source_id":"harnett_county_events","name":"Harnett County Upcoming Events","authority_tier":1,"publisher_type":"government","url":"https://harnett.org/","adapter_family":"custom_html","ingestion_methods":["html"],"readiness":"candidate","access":"public","enabled_for_phase_0_5":false,"county_geoids":["37085"],"localities":[],"coverage_tags":["health","parks","community","county_events"],"structure_score":2,"coverage_score":3,"maintenance_score":3,"cost_score":5,"notes":"Homepage exposes upcoming county events, but a stable dedicated feed/API was not confirmed."},{"source_id":"johnston_visitors_events","name":"Johnston County Visitors Bureau Events","authority_tier":2,"publisher_type":"tourism","url":"https://www.johnstoncountync.org/events/","adapter_family":"simpleview","ingestion_methods":["rss","html"],"readiness":"ready","access":"public","enabled_for_phase_0_5":true,"county_geoids":["37101"],"localities":["Smithfield","Clayton","Benson","Selma","Four Oaks"],"coverage_tags":["festivals","music","food","arts","tourism","community"],"structure_score":4,"coverage_score":5,"maintenance_score":4,"cost_score":5,"notes":"Countywide tourism calendar explicitly exposes RSS and event filtering."},{"source_id":"nash_county_calendar","name":"Nash County Calendar","authority_tier":1,"publisher_type":"government","url":"https://nashcountync.gov/calendar.aspx","adapter_family":"civicengage","ingestion_methods":["ical","rss","html"],"readiness":"ready","access":"public","enabled_for_phase_0_5":false,"county_geoids":["37127"],"localities":[],"coverage_tags":["civic"],"structure_score":5,"coverage_score":1,"maintenance_score":5,"cost_score":5,"notes":"Structured CivicEngage source with iCalendar/RSS, but observed event density is mostly county business."},{"source_id":"rocky_mount_calendar","name":"City of Rocky Mount Calendar","authority_tier":1,"publisher_type":"government","url":"https://www.rockymountnc.gov/Calendar.aspx","adapter_family":"civicengage","ingestion_methods":["ical","html"],"readiness":"candidate","access":"public","enabled_for_phase_0_5":false,"county_geoids":["37127"],"localities":["Rocky Mount"],"coverage_tags":["city_events","civic"],"structure_score":5,"coverage_score":2,"maintenance_score":5,"cost_score":5,"notes":"Useful Nash-area supplement; locality spans Nash/Edgecombe so event geography must be filtered."},{"source_id":"ticketmaster_discovery","name":"Ticketmaster Discovery API","authority_tier":2,"publisher_type":"aggregator","url":"https://developer.ticketmaster.com/products-and-docs/apis/discovery-api/v2/","adapter_family":"ticketmaster_api","ingestion_methods":["api"],"readiness":"requires_key","access":"api_key","enabled_for_phase_0_5":true,"county_geoids":["37183","37037","37063","37069","37077","37085","37101","37127"],"localities":[],"coverage_tags":["concerts","sports","ticketed_events"],"structure_score":5,"coverage_score":4,"maintenance_score":5,"cost_score":4,"notes":"Structured event search supports geographic radius/geoPoint filters; strong for major ticketed events."},{"source_id":"predicthq_events","name":"PredictHQ Events API","authority_tier":2,"publisher_type":"aggregator","url":"https://docs.predicthq.com/api/events/search-events","adapter_family":"predicthq_api","ingestion_methods":["api"],"readiness":"licensed","access":"subscription","enabled_for_phase_0_5":false,"county_geoids":["37183","37037","37063","37069","37077","37085","37101"